,Property_Name,Price_in_INR,No_of_Bedroom,Property_type
2594,"Crown Terrace, Dowanhill, Glasgow G12",44524200,4,Detached house for sale
2595,"Hawthorn Way, Cambuslang, Glasgow G72",44418190,5,Detached house for sale
2596,"""Castleford"" at Mayfield Boulevard, East Kilbride, Glasgow G75",44418190,4,End terrace house for sale
2597,"Haggs Road, Pollokshields, Glasgow G41",43994150,4,Flat for sale
2598,"Normal Avenue, Jordanhill, Glasgow G13",43994150,4,Detached house for sale
2599,"Antonine Road, Bearsden, Glasgow G61",43994150,5,Detached house for sale
2600,"""The Trewbrook"" at Honister Crescent, East Kilbride, Glasgow G75",43994150,5,Detached house for sale
2601,"Belvedere Avenue, Thornton View, East Kilbride G74",43675589,2,Detached house for sale
2602,"""Crombie"" at Woodhouse Drive, Jackton, East Kilbride G75",43464100,4,Terraced house for sale
2603,"Plot 6 - Maxwell Place, Maxwell Road, Glasgow G41",43464100,4,Town house for sale
2604,"Roman Court, Bearsden, Glasgow, East Dunbartonshire G61",43464100,4,Detached house for sale
2605,"Newlands Wynd, Newlandsmuir, East Kilbride G75",43464100,4,Detached house for sale
2606,"""Bayford Alt"" at Mayfield Boulevard, East Kilbride, Glasgow G75",43463569,4,Detached house for sale
2607,"""The Maxwell - Plot 145"" at East Kilbride, Glasgow G75",43357559,4,Detached house for sale
2608,"""The Avondale"" at Lavender Street, Glasgow G33",43251549,4,Detached house for sale
2609,"""Braemar"" at Auchinleck Road, Glasgow G33",42934050,5,Flat for sale
2610,"3/2, 57 Queensborough Gardens, Hyndland, Glasgow G12",42933519,5,Detached house for sale
2611,"""Balloch"" at Auchinleck Road, Glasgow G33",42722030,4,Detached house for sale
2612,"""The Hughes - Plot 80"" at Auchinleck Road, Glasgow G33",42404000,4,Flat for sale
2613,"Plot C1/8 - Twomax At Cottonyards, Old Rutherglen Road, ...",42404000,4,Detached house for sale
2614,"Callaghan Crescent, Jackton, Jackton G74",42404000,4,Semi-detached house for sale
2615,"Mount Annan Drive, Kings Park, Glasgow G44",42404000,5,Semi-detached house for sale
2616,"Blairbeth Drive, Kings Park G44",42404000,4,Detached house for sale
2617,"""The Rothesay"" at Daffodil Drive, Glasgow G33",42404000,4,Detached house for sale
2618,"Gateside Road, Barrhead, Glasgow G78",42403469,6,Detached house for sale
2619,"""Crombie"" at Pineta Drive, East Kilbride, Glasgow G74",42403469,4,Detached house for sale
2620,"""The Pinehurst"" at Lavender Street, Glasgow G33",42297990,4,Detached house for sale
2621,"Micklehouse Road, Baillieston, Glasgow G69",42297990,4,Detached house for sale
2622,"""Bayford"" at Mayfield Boulevard, East Kilbride, Glasgow G75",42191449,4,Flat for sale
2623,"""Connel"" at Jordanhill Drive, Off Southbrae Drive, ...",42191449,4,Detached house for sale
2624,"""Campbell"" at Woodhouse Drive, Jackton, East Kilbride G75",42085439,4,Detached house for sale
2625,"""Ralston"" at Auchinleck Road, Glasgow G33",41979960,4,Detached house for sale
2626,"""The Tambrook"" at Honister Crescent, East Kilbride, Glasgow G75",41873950,4,Terraced house for sale
2627,"Kilmailing Road, Cathcart, Glasgow G44",41873950,3,Land for sale
2628,"Stockiemuir Avenue, Bearsden, Glasgow G61",41873950,5,Flat for sale
2629,"110 Elderslie Street, Flat 1-3 And 2-3, Glasgow G3",41873950,4,Semi-detached house for sale
2630,"Kessington Drive, Bearsden, Glasgow, East Dunbartonshire G61",41873950,4,Detached house for sale
2631,"""The Rothesay"" at Daffodil Drive, Glasgow G33",41873950,4,Detached house for sale
2632,"Deaconsgrange Road, Thornliebank, Glasgow, Glasgow City G46",41873950,5,Semi-detached house for sale
2633,"Plot 15 - The Fieldings, Newlands Road, East Kilbride, ...",41873419,4,Detached house for sale
2634,"""The Tambrook"" at Honister Crescent, East Kilbride, Glasgow G75",41555389,4,Detached house for sale
2635,"""Balloch"" at Pineta Drive, East Kilbride, Glasgow G74",41555389,4,Detached house for sale
2636,"""Balloch"" at Pineta Drive, East Kilbride, Glasgow G74",41343900,4,Detached house for sale
2637,"Rosehall Way, Glasgow G71",41343900,4,Detached house for sale
2638,"Kenmuirhill Gardens, Mount Vernon, Glasgow G32",41343900,4,Semi-detached house for sale
2639,"Limeside Avenue, Rutherglen, Glasgow G73",41343900,4,Detached house for sale
2640,"Strathallan Gate, Hairmyres, East Kilbride G75",41343369,4,Detached house for sale
2641,"""The Skybrook"" at Honister Crescent, East Kilbride, Glasgow G75",41343369,4,Detached house for sale
2642,"""Balloch"" at Harvester Avenue, Cambuslang, Glasgow G72",41131349,3,Detached house for sale
2643,"""The Tidebrook"" at Honister Crescent, East Kilbride, Glasgow G75",41131349,4,Detached house for sale
2644,"""The Tidebrook"" at Honister Crescent, East Kilbride, Glasgow G75",41025339,4,Detached house for sale
2645,"""The Victoria"" at Lavender Street, Glasgow G33",41025339,4,Detached house for sale
2646,"""The Avondale"" at East Kilbride, Glasgow G75",40813850,4,Detached house for sale
2647,"Belvedere Avenue, East Kilbride, Glasgow G74",40813850,4,Detached house for sale
2648,"Dumbreck Road, Glasgow G41",40813850,3,Detached bungalow for sale
2649,"Williamwood Drive, Netherlee, East Renfrewshire G44",40813850,2,Country house for sale
2650,"Plot 18, (Sycamore Type) 2 Kirkwood Place, Glasgow G33",40601299,4,Detached house for sale
2651,"""The Pinehurst"" at East Kilbride, Glasgow G75",40495820,4,Detached house for sale
2652,"""The Geddes - Plot 40"" at Auchinleck Road, Glasgow G33",40495820,4,Detached house for sale
2653,"""The Geddes - Plot 81"" at Auchinleck Road, Glasgow G33",40283800,4,Detached house for sale
2654,"""The Nairn"" at Daffodil Drive, Glasgow G33",40283800,3,Detached house for sale
2655,"""The Geddes - Plot 187"" at Springfield Road, Barrhead, ...",40283269,3,Detached house for sale
2656,"""The Avondale"" at East Kilbride, Glasgow G75",40230795,3,Detached house for sale
2657,"""The Hume - Plot 146"" at Springfield Road, Barrhead, Glasgow G78",40230795,4,Detached house for sale
2658,"""The Hume - Plot 184"" at Springfield Road, Barrhead, Glasgow G78",40177790,1,Detached house for sale
2659,"Fairlie, Stewartfield, East Kilbride G74",40071780,3,Detached house for sale
2660,"""The Geddes - Plot 141"" at East Kilbride, Glasgow G75",40071249,4,Detached house for sale
2661,"""Dean"" at Woodhouse Drive, Jackton, East Kilbride G75",40071249,4,Detached house for sale
2662,"""Campbell"" at Pineta Drive, East Kilbride, Glasgow G74",40071249,2,Detached house for sale
2663,"""Campbell"" at Pineta Drive, East Kilbride, Glasgow G74",39753750,2,Flat for sale
2664,"Kirklee Gate, Kelvinside, Glasgow G12",39753750,2,Detached bungalow for sale
2665,"Woodside Avenue, Rutherglen G73",39753750,3,Terraced house for sale
2666,"Eastwoodmains Road, Clarkston, East Renfrewshire G76",39753750,3,Detached house for sale
2667,"""The Rainbrook"" at Honister Crescent, East Kilbride, Glasgow G75",39753750,2,Detached house for sale
2668,"""The Palmbrook"" at Honister Crescent, East Kilbride, Glasgow G75",39753750,4,Detached house for sale
2669,"""Lockwood Alt"" at Mayfield Boulevard, East Kilbride, Glasgow G75",39753750,2,Flat for sale
2670,"8 Princes Terrace, Glasgow G12",39753750,6,Semi-detached house for sale
2671,"Florence Drive, Giffnock, Glasgow G46",39753219,4,Detached house for sale
2672,"""Dean"" at Auchinleck Road, Glasgow G33",39753219,2,Detached house for sale
2673,"""The Fraser - Plot 144"" at East Kilbride, Glasgow G75",39541199,1,Detached house for sale
2674,"""The Victoria"" at East Kilbride, Glasgow G75",39541199,2,Detached house for sale
2675,"""Craigston"" at Pineta Drive, East Kilbride, Glasgow G74",39223700,5,Semi-detached house for sale
2676,"Calderwood Road, Rutherglen, Glasgow, South Lanarkshire G73",39223700,4,Bungalow for sale
2677,"Rysland Avenue, Newton Mearns, Glasgow G77",39223700,2,Flat for sale
2678,"Kilmarnock Road, Newlands, Glasgow G43",47704500,3,
2679,"South Manse, Panmure Gardens",8480693,2,
2680,39 Union Grove,24382300,2,
2681,26 Morningside Road,39753750,1,
2682,12 Abbotshall Drive,19081800,2,
2683,163 Clifton Road,16961600,1,
2684,"Flat 1, 6 Blenheim Place",5830550,2,
2685,"Top Floor Right, 168 Crown Street",10388980,2,
2686,79 Wood Street,21202000,2,
2687,1 Orchard Walk,31696990,1,
2688,3 Pine Tree View,14311350,3,
2689,12 Gairnshiel Avenue,31272950,3,
2690,9 Rosehill Terrace,17491650,2,
2691,"55 Ocean Apartments, 52-54 Park Road",59895650,1,
2692,99 Fountainhall Road,53005000,4,
2693,17 Woodlands Crescent,12721200,2,
2694,8 School Walk,7420700,2,
2695,43 Baker Street,12191150,3,
2696,"Flat B, 31 Adelphi",61485800,2,
2697,97 Hamilton Place,73676950,2,
2698,"Woodlands, 70 North Deeside Road",20671950,1,
2699,9b Broomhill Road,19293820,2,
2700,82 Hilton Heights,20141900,2,
2701,4 Cammach Circle,23057175,4,
2702,17 May Baird Gardens South,7420593,1,
2703,10 Northfield Place,14841400,3,
2704,10 Marine Court,7950750,3,
2705,196 Union Grove,15371450,3,
2706,11 Bedford Place,15371450,2,
2707,17 Berneray Place,16802585,2,
2708,43 Fonthill Terrace,9434890,2,
2709,99 Fairview Circle,27562600,5,
2710,5 Broaddykes Drive,22262100,2,
2711,13 Sinclair Crescent,6307595,2,
2712,139 Kirkhill Road,9434890,3,
2713,426 Lee Crescent North,31803000,4,
2714,Braeriach,25972450,1,2 bedroom flat for sale
2715,"127/10 Willowbrae Road, Willowbrae, EH8 7HL",29152750,3,2 bedroom flat for sale
2716,"Royal Park Terrace, Edinburgh EH8",45054250,1,3 bedroom flat for sale
2717,"Flat 2, 221 Morningside Road, Morningside, EH10 4QT",38693650,2,2 bedroom flat for sale
2718,"160/4 Bruntsfield Place, Bruntsfield, Edinburgh, EH10 4ER",29152750,3,2 bedroom flat for sale
2719,"45/7 Orchard Brae Avenue, Orchard Brae, Edinburgh, EH4 2UP",15901500,2,1 bedroom flat for sale
2720,"92/10 Restalrig Road South, Edinburgh, EH7 6JB",27562600,2,2 bedroom flat for sale
2721,"37 (3F1), Sandport Street, Edinburgh, EH6 6EP",30742900,3,2 bedroom terraced house for sale
2722,"13 Roseburn Avenue, Edinburgh, EH12 5PD",24700330,3,4 bedroom flat for sale
2723,"Broomhouse Street North, Edinburgh EH11",13569280,1,1 bedroom flat for sale
2724,"3F2, 13 Peffer Street, Edinburgh, EH16 4AZ",63606000,1,3 bedroom villa for sale
2725,"38/1 Garscube Terrace, Murrayfield, EH12 6BN",38163600,4,3 bedroom semi-detached villa for sale
2726,"Kingsknowe Crescent, Edinburgh EH14",33923200,3,3 bedroom semi-detached house for sale
2727,"Greenfield Crescent, Balerno, EH14",25442400,3,2 bedroom ground floor flat for sale
2728,"Thorntree Street, Leith, Edinburgh, EH6",30742900,2,2 bedroom ground floor flat for sale
2729,"Murieston Crescent, Dalry, Edinburgh, EH11",18869780,2,2 bedroom flat for sale
2730,"Coillesdene Grove, Edinburgh EH15",82157750,3,5 bedroom detached house for sale
2731,"65 Orchard Road, Craigleith, Edinburgh, EH4 2EX",24912350,4,2 bedroom flat for sale
2732,"27A Pitt Street, Bonnington, EH6 4BY",14841400,2,2 bedroom end of terrace house for sale
2733,"34 Drum Crescent, Gilmerton, EH17 7DZ",33923200,3,3 bedroom semi-detached villa for sale
2734,"Lochiel Avenue, Edinburgh EH17",50884800,1,4 bedroom semi-detached house for sale
2735,"34 Ulster Crescent, Willowbrae, EH8 7LD",15371450,3,1 bedroom retirement property for sale
2736,"28/56 Roseburn Place, Roseburn, Edinburgh, EH12 5NX",26497199,2,3 bedroom terraced house for sale
2737,"35 Clermiston Grove, Edinburgh, EH4 7DA",15795490,2,1 bedroom flat for sale
2738,"13/9 Murdoch Terrace, Edinburgh, EH11 1BD",30742900,5,2 bedroom flat for sale
2739,"11 (1F3) Rodney Street, Canonmills, EH7 4EN",41873950,1,3 bedroom detached bungalow for sale
2740,"Kingsknowe Avenue, Edinburgh EH14",15901500,4,2 bedroom flat for sale
2741,"Redbraes Place, Edinburgh EH7",32863100,2,2 bedroom flat for sale
2742,"83 Polwarth Gardens, Edinburgh, EH11",28622700,2,3 bedroom flat for sale
2743,"55/11 Caledonian Crescent, Edinburgh, EH11",24382300,7,3 bedroom terraced house for sale
2744,"2 Westland Cottages, Edinburgh, EH17 8QT",16961600,1,1 bedroom flat for sale
2745,"7 2F2, Watson Crescent, Edinburgh, EH11 1HD",16113520,1,1 bedroom flat for sale
2746,"Sciennes House Place, Edinburgh EH9",30742900,4,4 bedroom townhouse for sale
2747,"Craigmount Brae, Edinburgh EH12",43464100,5,3 bedroom flat for sale
2748,"Polwarth Gardens, Edinburgh EH11",28622700,1,3 bedroom semi-detached villa for sale
2749,"Redhall Road, Edinburgh EH14",14841400,1,2 bedroom flat for sale
2750,"31 Newtoft Street, Edinburgh EH17 8RF",28092650,1,2 bedroom flat for sale
2751,"16/7 Broughton Road, EDINBURGH, EH7 4EB",53005000,2,3 bedroom flat for sale
2752,"9 Abercorn Terrace, Portobello, EH15 2DD",68906500,3,4 bedroom detached house for sale
2753,"11 Millbank, Balerno, EH14 7GA",58305500,3,2 bedroom villa for sale
2754,"3A Palmerston Road, Grange, Edinburgh, EH9 1TL",21202000,2,3 bedroom semi-detached house for sale
2755,"29 East Kilngate Place, Edinburgh, EH17 8UR",15371450,2,1 bedroom flat for sale
2756,"Craigmount Brae, Edinburgh EH12",47704500,4,3 bedroom flat for sale
2757,"Newbattle Terrace, Morningside",30742369,2,2 bedroom apartment for sale
2758,"KINGFISHER - TYPE A at Cammo Meadows Apartments Meadowsweet Drive, Edinburgh EH4",40177790,2,2 bedroom flat for sale
2759,"6 ( Flat 5) Rocheid Park, Fettes, Edinburgh",103359750,2,5 bedroom semi-detached house for sale
2760,"Dell Road, Colinton, Edinburgh, EH13",37103500,1,1 bedroom apartment for sale
2761,"Great King Street, New Town, Edinburgh, EH3",56715350,4,4 bedroom bungalow for sale
2762,"84 Lanark Road West, Currie, EH14",40283800,3,2 bedroom apartment for sale
2763,"Stafford Street, Edinburgh, Midlothian",23322200,2,2 bedroom apartment for sale
2764,"Duff Street, Edinburgh, Midlothian",355133500,1,7 bedroom terraced house for sale
2765,"Forres Street, Edinburgh, EH3",30212850,2,1 bedroom flat for sale
2766,"1/7 Ogilvie Terrace, Edinburgh, EH11 1NS",9010850,2,1 bedroom flat for sale
2767,"23 Admiralty Street, Leith, Edinburgh, EH6 6JT",43994150,2,4 bedroom apartment for sale
2768,"Morningside Road, Edinburgh, City of Edinburgh, EH10 4QL",89578450,2,5 bedroom detached house for sale
2769,"Carfrae Road, Blackhall, Edinburgh",36043400,4,1 bedroom flat for sale
2770,"7 (3F3) Marchmont Crescent, Marchmont, Edinburgh, EH9 1HN",15901500,3,1 bedroom flat for sale
2771,"Stewart Terrace, Edinburgh EH11",24382300,4,1 bedroom flat for sale
2772,"2 McLaren Terrace, Haymarket, EH11 2BN",21202000,3,2 bedroom flat for sale
2773,"58/9 Great Junction Street, Leith, Edinburgh, EH6 5LD",76327200,1,3 bedroom apartment for sale
2774,"Kinnear Road, Inverleith, Edinburgh, EH3",41343793,3,3 bedroom terraced house for sale
2775,"76 Merchiston Avenue, Merchiston, Edinburgh EH10 4PA",21201469,1,2 bedroom end of terrace house for sale
2776,"30 East Farm of Gilmerton, Gilmerton, EH17 8TG",50354750,3,2 bedroom flat for sale
2777,"Buckingham Terrace, Edinburgh, Midlothian, EH4",99119350,4,4 bedroom terraced house for sale
2778,"Granby Road, Edinburgh, EH16",29152750,5,2 bedroom apartment for sale
2779,"Home Street, Fountainbridge, Edinburgh, EH3",39753750,2,2 bedroom ground floor flat for sale
2780,"Montpelier, Bruntsfield, Edinburgh EH10",19611850,1,2 bedroom terraced house for sale
2781,"Sighthill Loan, Sighthill, Edinburgh, EH11",47704500,2,1 bedroom flat for sale
2782,"43 Falcon Gardens, Morningside, EH10 4AR",31803000,3,4 bedroom terraced house for sale
2783,"16 Granton Park Avenue North, Granton, EH5 1GW",95409000,2,3 bedroom apartment for sale
2784,"Plot 59 - Waverley Square, New Street, Edinburgh, EH8",31803000,2,2 bedroom flat for sale
2785,"114 Balgreen Road, Edinburgh, EH12 5UB",28622700,3,1 bedroom flat for sale
2786,"Simpson Loan, Quartermile, Edinburgh, EH3",20671950,2,2 bedroom flat for sale
2787,"64/6 Slateford Road, EDINBURGH, EH11 1QX",30212850,1,2 bedroom flat for sale
2788,"Flat 5, 16 Sandpiper Drive, Newhaven, Edinburgh, EH6 6QJ",38693650,1,2 bedroom apartment for sale
2789,"Mid Steil, Craiglockhart, Edinburgh, EH10",41343900,2,2 bedroom mews for sale
2790,"Cornwallis Place, New Town, Edinburgh, EH3",45054250,4,4 bedroom detached house for sale
2791,"4 The Gallolee, Edinburgh, EH13 9QJ",51414850,4,3 bedroom detached house for sale
2792,"Orchard Bank, Craigleith, Edinburgh, EH4",126681950,4,4 bedroom detached house for sale
2793,"Cramond Glebe Road, Cramond, Edinburgh, EH4",47174450,4,3 bedroom apartment for sale
2794,"Strathearn Road, Marchmont, Edinburgh, EH9",27562600,3,1 bedroom flat for sale
2795,"Shrubhill Walk, Edinburgh, EH7",89578450,5,3 bedroom end of terrace house for sale
2796,"9A Summerside Street, Trinity, Edinburgh, EH6",18021169,1,1 bedroom retirement property for sale
2797,"Maxwell Street, Edinburgh EH10",44524200,2,3 bedroom flat for sale
2798,"Prospect Bank Terrace, Edinburgh EH6",47704500,3,4 bedroom detached bungalow for sale
2799,"40 Craigmount View, Edinburgh, EH12 8BT",103359750,4,5 bedroom end of terrace house for sale
2800,"The Coach House, 90 Clermiston Road, Clerwood, Edinburgh, EH12",21202000,2,2 bedroom flat for sale
2801,"Craigend Park, Edinburgh EH16",11661100,2,1 bedroom ground floor flat for sale
2802,"40 Magdalene Loan, Brunstane, EH15 3DP",26502500,4,2 bedroom flat for sale
2803,"81/7 (4F1) Grove Street, Haymarket, Edinburgh, EH3",31803000,2,3 bedroom flat for sale
2804,"Flat 6, 33 Parkside Terrace, Newington, EH16 5XP",31272950,3,2 bedroom flat for sale
2805,"Kimmerghame Terrace, Fettes, Edinburgh, EH4",19081800,2,2 bedroom ground floor flat for sale
2806,"Parkhead Avenue, Edinburgh, EH11",83217850,2,3 bedroom duplex for sale
2807,"Flat 14, 49 Sassoon Grove, Craighouse, Edinburgh, EH10",16961600,3,2 bedroom terraced house for sale
2808,"Upper Craigour, Liberton, Edinburgh, EH17",21202000,3,1 bedroom flat for sale
2809,"20/3 Dalmeny Street, Edinburgh EH6 8RA",16961600,4,1 bedroom flat for sale
2810,"17/5 Thorntree Street, Edinburgh EH6 8PU",21201469,3,2 bedroom terraced house for sale
2811,"Nellfield, Edinburgh EH16",57457420,4,4 bedroom detached house for sale
2812,"Plot 48, Maplewood at West Craigs Manor, Off Craigs Road EH12",56715350,4,4 bedroom detached house for sale
2813,"Plot 45, Maplewood at West Craigs Manor, Off Craigs Road EH12",50566770,4,4 bedroom semi-detached house for sale
2814,"Plot 94, Larchwood at West Craigs Manor, Off Craigs Road EH12",49824700,2,4 bedroom semi-detached house for sale
2815,"Plot 93, Larchwood at West Craigs Manor, Off Craigs Road EH12",27032550,2,3 bedroom apartment for sale
2816,"East Pilton Farm Avenue, Fettes, Edinburgh",116611000,2,5 bedroom property for sale
2817,"Murrayfield Road, Edinburgh",32863100,3,1 bedroom apartment for sale
2818,"Simpson Loan, Edinburgh, Midlothian",25442400,3,2 bedroom apartment for sale
2819,"Granton, Granton EH5",35513350,2,3 bedroom semi-detached house for sale
2820,"Muir Wood Crescent, Currie, Edinburgh, EH14",76857250,2,4 bedroom terraced house for sale
2821,"Dudley Gardens, Trinity, Edinburgh, EH6",41873950,2,2 bedroom apartment for sale
2822,"Spottiswoode Road, Marchmont, Edinburgh, EH9",38693650,2,2 bedroom apartment for sale
2823,"Bruntsfield Place, Bruntsfield, Edinburgh, EH10",79507500,2,4 bedroom terraced house for sale
2824,"20 Esplanade Terrace, Joppa, Edinburgh, EH15 2ES",20671950,1,2 bedroom terraced house for sale
2825,"Captains Drive, Edinburgh EH16",55125200,4,3 bedroom terraced house for sale
2826,"Cammo Walk, Cammo, Edinburgh, EH4",59365600,2,2 bedroom flat for sale
2827,"38 Arden Street, Marchmont, EH9 1BW",19081800,2,2 bedroom semi-detached house for sale
2828,"Burdiehouse Road, Burdiehouse, Edinburgh, EH17 8AF",21202000,2,3 bedroom duplex for sale
2829,"Saughton Road, Saughton, Edinburgh, EH11",38163069,4,3 bedroom terraced house for sale
2830,"Coull at Barratt @ West Craigs Brogan Crescent, Edinburgh EH12",180217000,1,4 bedroom penthouse for sale
2831,"South Oswald Road, Grange, Edinburgh, EH9",28092650,3,3 bedroom semi-detached house for sale
2832,"11 Mortonhall Park Bank, Edinburgh, EH17 8ST",111310500,2,4 bedroom end of terrace house for sale
2833,"Wardie Road, Trinity, Edinburgh, EH5",31272950,1,4 bedroom flat for sale
2834,"45 Dundee Terrace, Polwarth Edinburgh",29152750,2,4 bedroom flat for sale
2835,"Easter Road, Leith",53005000,2,2 bedroom flat for sale
2836,"Flat 104/1 Donaldson Drive, West End, Edinburgh, EH12 5FS",15901500,2,2 bedroom flat for sale
2837,"8/6 Oxgangs Farm Gardens, EDINBURGH, EH13 9QE",27562600,1,2 bedroom semi-detached house for sale
2838,"72 Currievale Drive, Currie, Edinburgh, EH14 5RW",28622700,5,3 bedroom terraced house for sale
2839,"14 Alnwickhill Court, Alnwickhill, Edinburgh, EH16 6YG",84277950,1,3 bedroom detached house for sale
2840,"2C, Church Hill, Edinburgh, EH10 4BQ",26502500,3,2 bedroom flat for sale
2841,"19/2 Harden Place, Edinburgh, EH11 1JD",20671950,2,2 bedroom flat for sale
2842,"Gorgie Road, Edinburgh EH11",23852250,3,2 bedroom semi-detached villa for sale
2843,"Broomhall Gardens, Edinburgh EH12",22474120,3,2 bedroom flat for sale
2844,"8/5 Goldcrest Place, Cammo, Edinburgh, EH4 8GS",21202000,5,2 bedroom flat for sale
2845,"72 Flat 3, Willowbrae Road, Edinburgh, EH8 7HA",17491650,3,1 bedroom apartment for sale
2846,"Rossie Place, Leith, Edinburgh, EH7",58835550,3,4 bedroom end of terrace house for sale
2847,"Caiyside, Fairmilehead, Edinburgh, EH10",31272950,5,2 bedroom apartment for sale
2848,"Gilmore Place, Bruntsfield, Edinburgh, EH3",30742900,5,2 bedroom apartment for sale
2849,"Silvermills, Stockbridge, Edinburgh, EH3",28569695,5,2 bedroom apartment for sale
2850,"West Bowling Green Street, Bonnington, Edinburgh, EH6",41873950,2,4 bedroom detached house for sale
2851,"Silverknowes Eastway, Silverknowes, Edinburgh, EH4",34453250,2,1 bedroom apartment for sale
2852,"Simpson Loan, Lauriston, Edinburgh, EH3",39541199,2,3 bedroom apartment for sale
2853,"Rosevale at Merchant Quay Salamander Street, Leith EH6",36573450,4,2 bedroom apartment for sale
2854,"West Savile Terrace, Newington, Edinburgh, EH9",15371450,1,1 bedroom apartment for sale
2855,"Lasswade Road, Liberton, Edinburgh, EH16",58305500,4,2 bedroom apartment for sale
2856,"Greenhill Place, Greenhill, Edinburgh, EH10",63075950,4,2 bedroom apartment for sale
2857,"Fountainhall Road, Grange, Edinburgh, EH9",49824700,2,2 bedroom apartment for sale
2858,"Barnton Grove, Barnton, Edinburgh, EH4",31696990,3,1 bedroom house for sale
2859,"Lennox Street Lane, New Town, Edinburgh, EH4",79507500,4,5 bedroom detached house for sale
2860,"Torphin Road, Colinton, Edinburgh, EH13",24382300,2,1 bedroom apartment for sale
2861,"St Stephen Street, Stockbridge, Edinburgh, EH3",72616850,6,3 bedroom apartment for sale
2862,"St Stephen Street, Stockbridge, Edinburgh, EH3",39223700,2,2 bedroom apartment for sale
2863,"Comiston Road, Morningside, Edinburgh, EH10",55655250,2,3 bedroom terraced house for sale
2864,"Dewar Place Lane, West End, Edinburgh, EH3",41343900,2,3 bedroom semi-detached house for sale
2865,"Swanston Gardens, Fairmilehead, Edinburgh, EH10",105479950,3,5 bedroom semi-detached house for sale
2866,"Ravelston Dykes, Ravelston, Edinburgh, EH4",47704500,4,3 bedroom apartment for sale
2867,"Ravelston Garden, Ravelston, Edinburgh, EH4",82157750,2,3 bedroom apartment for sale
2868,"Mansionhouse Road, Grange, Edinburgh, EH9",153714500,3,5 bedroom end of terrace house for sale
2869,"Gordon Terrace, Newington, Edinburgh, EH16",212020000,6,5 bedroom link detached house for sale
2870,"South Lauder Road, Grange, Edinburgh, EH9",76857250,2,5 bedroom detached house for sale
2871,"Burnbrae, Corstorphine, Edinburgh, EH12",39753750,4,2 bedroom apartment for sale
2872,"Montpelier Terrace, Bruntsfield, Edinburgh, EH10",23852250,2,2 bedroom apartment for sale
2873,"Tait Wynd, Brunstane, Edinburgh, EH15",28092650,2,2 bedroom apartment for sale
2874,"29 Falcon Court, Morningside, Edinburgh, EH10",71556750,1,4 bedroom end of terrace house for sale
2875,"Whitehouse Road, Cramond, Edinburgh, EH4",21732050,2,1 bedroom flat for sale
2876,"Edina Street, Edinburgh EH7",45054250,2,4 bedroom semi-detached bungalow for sale
2877,"Drum Brae South, Edinburgh EH12",55655250,4,4 bedroom semi-detached villa for sale
2878,"St Ninian's Road, Edinburgh EH12",24912350,1,2 bedroom flat for sale
2879,"16/8 Rennie's Isle ,The Shore, EDINBURGH, EH6 6QB",53005000,2,3 bedroom semi-detached house for sale
2880,"1 Little Road, Liberton, EH16 6SH",47704500,2,4 bedroom detached house for sale
2881,"Caulderhame Road, Currie, Edinburgh, EH14 5TU",37103500,1,2 bedroom flat for sale
2882,"32/3 St Stephen Street, Stockbridge, Edinburgh, EH3 5AL",259724500,4,6 bedroom detached house for sale
2883,"Old Craig, Craighouse, Edinburgh, EH10",42404000,3,2 bedroom flat for sale
2884,"23 (MD) East Preston Street, Newington, Edinburgh, EH8",23322200,1,2 bedroom flat for sale
2885,"45/1 Caledonian Crescent, Dalry, Edinburgh, EH11",21148995,2,2 bedroom apartment for sale
2886,"New Mart Place, Edinburgh",55655250,3,3 bedroom apartment for sale
2887,"Logie Green Road, Edinburgh, Midlothian",82157750,3,4 bedroom apartment for sale
2888,"Mayfield Road, Edinburgh, Midlothian",29152750,2,2 bedroom apartment for sale
2889,"Summerhall Place, Edinburgh, Midlothian",42404000,2,3 bedroom apartment for sale
2890,"Spylaw Road, Edinburgh",159015000,5,6 bedroom detached house for sale
2891,"Ettrick Road, Edinburgh",27032550,1,2 bedroom apartment for sale
2892,"Granton, Granton EH5",41873950,1,4 bedroom flat for sale
2893,"314 Ferry Road, Edinburgh, EH5",21202000,2,2 bedroom flat for sale
2894,"3/6 St. Clair Avenue, Leith, Edinburgh, EH6 8JS",17491650,4,2 bedroom flat for sale
2895,"Whitson Road, Balgreen, Edinburgh, EH11",38693650,3,1 bedroom apartment for sale
2896,"Randolph Crescent, New Town, Edinburgh, EH3",29682800,4,2 bedroom flat for sale
