,Property_Name,Price_in_INR,No_of_Bedroom,Property_type
0,"Wimpole Street, Marylebone, London, W1G",450542500,3,Apartment
1,"One Hyde Park, Knightsbridge",2147483648,5,Apartment
2,"Buckingham Gate, SW1",2147483648,9,Terraced
3,"Buckingham Gate, Westminster, SW1E",2147483648,8,Terraced
4,"Belgravia Gate, Grosvenor Crescent, Belgravia, London, SW1X",2147483648,6,Not Specified
5,"Wilton Crescent, London, SW1X",2147483648,8,Terraced
6,"Addison Road, London, W14",2147483648,8,Detached
7,"Chester Square, London, SW1W",2147483648,6,Terraced
8,"Brick Street, Mayfair, London, W1J",2147483648,7,House
9,"Brick Street, Mayfair, London, W1J",2147483648,7,Terraced
10,"Chester Square, London, SW1W",2147483648,6,Terraced
11,"Addison Road, Holland Park, W14",2147483648,8,Detached
12,"Royal Westminster, London",2147483648,7,Detached
13,"Merton Lane, London, N6",2147483648,6,Detached
14,"Merton Lane, London, N6",2147483648,10,Detached
15,"Merton Lane, Highgate, London, N6",2147483648,5,House
16,"Merton Lane, London, N6",2147483648,6,Detached
17,"Princes Gate, Knightsbridge, London, SW7",2147483648,12,Detached
18,"FREEHOLD House in Park Street, Mayfair, W1K",2147483648,11,Terraced
19,"Avenue Road, NW8",2147483648,8,Detached
20,"Cadogan Place, Belgravia, London, SW1X",2147483648,6,Terraced
21,"Cambridge Park, Twickenham, Richmond, TW1.",2147483648,9,Detached
22,"Piccadilly, Mayfair",2147483648,6,House
23,"Cambridge Park, Twickenham, Greater London, TW1",2147483648,9,Detached
24,"Princes Gate, London, SW7",2147483648,6,House
25,"Merrivale, Camden Street, NW1",31803000,1,Apartment
26,"Princes Gate, London, SW7",2147483648,7,Terraced
27,"Holland Villas Road, London, W14",2147483648,12,Detached
28,"Abbotsbury Road, London, W14",2147483648,7,Detached
29,"Eaton Terrace, London, SW1W",2147483648,5,Mews
30,"Eaton Terrace, Belgravia, London, SW1W",2147483648,4,Terraced
31,"Holland Villas Road, London, W14",2147483648,9,Detached
32,"Marylebone High Street, London, W1U",2147483648,3,Penthouse
33,"Marylebone Square, Marylebone W1",2147483648,3,Flat
34,"Moxon Street, W1U",2147483648,3,Block of Apartments
35,"Down Street Mews, London, W1J",2147483648,8,Mews
36,"Down Street Mews, Mayfair, London, W1J",2147483648,9,Semi-Detached
37,"Knightsbridge Gate, Apartment 6, 55 Knightsbridge, SW1X",2147483648,6,Penthouse
38,"Knightsbridge, London, SW1X",2147483648,6,Apartment
39,"Park Crescent, Regent's Park, London, W1B",2147483648,5,Duplex
40,"Old Park Lane, London, W1K",2147483648,5,Apartment
41,"Cambridge Gate, Regents Park, London, NW1",2147483648,5,Flat
42,"Elsworthy Road, London, NW3",2147483648,5,Detached
43,"Elsworthy Road, St John's Wood, London, NW3",2147483648,5,Detached
44,"Lowndes Square, London, SW1X",2147483648,10,Terraced
45,"Chester Square, London, SW1W",2147483648,6,Terraced
46,"Lowndes Square, London, SW1X",2147483648,10,Town House
47,"One Hyde Park, Knightsbridge",2147483648,3,Apartment
48,"Elsworthy Road, Primrose Hill, London",2147483648,5,Detached
49,"Cornwall Terrace, Regent's Park",2147483648,6,Terraced
50,"Havil Street, London",45054250,2,Maisonette
51,"Elsworthy Road, London, NW3",2147483648,5,Semi-Detached
52,"Chester Square, London, SW1W",2147483648,6,Town House
53,"Chester Square, London",2147483648,6,House
54,Chester Square,2147483648,6,Terraced
55,"Cumberland Terrace, Regent's Park, London, NW1",2147483648,6,Terraced
56,"Herbert Crescent, London, SW1X",2147483648,7,Terraced
57,"St. John's Wood, London, NW8",2147483648,8,Detached
58,"Winnington Road, London, N2",2147483648,6,Detached
59,"Winnington Road, N2",2147483648,6,Detached
60,"One Kensington Gardens, Kensington, London, W8 5NX",2147483648,5,Apartment
61,"Phillimore Gardens, London, W8",2147483648,5,Semi-Detached
62,"One Kensington Gardens, Kensington Road, London",2147483648,5,Flat
63,"Phillimore Gardens, London, W8",2147483648,5,End of Terrace
64,"The Bishops Avenue, Hampstead, London, N2",2147483648,5,Penthouse
65,"Culross Street, Mayfair, London, W1K",2147483648,6,Terraced
66,"Holland Villas Road, Holland Park, London",2147483648,6,Terraced
67,"Holland Villas Road, Holland Park, London, W14",2147483648,6,Detached
68,"Buckingham Gate, St James's Park",2147483648,5,House
69,"Ilchester Place, London, W14",2147483648,7,Terraced
70,"Pembroke Gardens,London,W8",2147483648,7,Detached
71,"Pembroke Gardens, Kensington, W8",2147483648,8,Detached
72,"Wadham Gardens, St John's Wood, London, NW3",2147483648,4,Detached
73,"Stratford Place, London, W1C",2147483648,5,Town House
74,"Knightsbridge Gate, Apartment 5, 1 William Street, London, SW1X",2147483648,5,Penthouse
75,"Ullathorne Road, London, SW16",39753750,2,Apartment
76,"Wadham Gardens, London, NW3",2147483648,5,Detached
77,"William Street, London, SW1X",2147483648,5,Apartment
78,"Hanover Terrace, Regents Park, London, NW1",2147483648,6,Terraced
79,"Knightsbridge Gate, Apartment 5, 1 William Street, London, SW1X",2147483648,5,Penthouse
80,"Ashburton Place, London, W1J",2147483648,3,Apartment
81,"Knightsbridge Gate, Knightsbridge, London, SW1X.",2147483648,5,Not Specified
82,"Lygon Place, London, SW1W",2147483648,6,Town House
83,"Palace Court, London, W2",2147483648,7,Detached
84,"Lygon Place, Belgravia, London, SW1W.",2147483648,7,Terraced
85,"Bedford Gardens, Kensington, London",2147483648,6,Semi-Detached
86,"Hamilton Terrace, St John's Wood, London, NW8",2147483648,5,Detached
87,"Hamilton Terrace, St John's Wood, London, NW8",2147483648,5,Detached
88,"Lowndes Square, London, SW1X",2147483648,8,Penthouse
89,"Chester Square, London, SW1W",2147483648,6,House
90,"Hertford Street, Mayfair, London., W1J",2120200000,10,Terraced
91,"Mount Street, Mayfair, London, W1K",2120200000,4,Flat
92,"Compton Avenue, N6",2120200000,3,Land for sale
93,"One Hyde Park, Knightsbridge",2120200000,6,Apartment
94,"Romneys House, NW3",2120200000,7,House
95,"The Bishops Avenue, Hampstead, N2",2120200000,3,House
96,"Grosvenor Square, London, W1K",2120200000,12,Apartment
97,"Addison Road, London, W14",2120200000,5,Detached
98,"Pont Street, Knightsbridge",2120200000,5,Flat
99,"Gilston Road, Chelsea, London, SW10",2120200000,2,End of Terrace
100,"Oratory Apartments, Canning Town, E16",45054250,4,Apartment
101,"Mount Street, London, W1K",2120200000,5,Apartment
102,"Park Lane, Mayfair",2114899500,5,Flat
103,"Grosvenor Square, Mayfair, London, W1K",2114899500,5,Penthouse
104,"Montrose Place, London, SW1X",2114899500,11,Apartment
105,"Frognal, Hampstead Village",2114899500,5,Detached
106,"Montrose Place, Belgravia, SW1X",2114899500,4,Flat
107,"Ebury Square, London, SW1W",2114899500,10,Flat
108,"Frognal, Hampstead, NW3",2114899500,5,Detached
109,"Grosvenor Square, Mayfair",2114899500,5,Flat
110,"Portland Place, Marylebone, W1B",2093697500,6,End of Terrace
111,"Hanover Terrace, Regent's Park, London, NW1",2093697500,6,Terraced
112,"Hyde Park Gate, London, SW7",2067195000,6,Terraced
113,"Queens Grove, St John's Wood, London, NW8",2067195000,6,Semi-Detached
114,"Wilton Crescent, London, SW1X",2067195000,6,Terraced
115,"Lyall Street, London, SW1X",2067195000,4,Villa
116,"Courtenay Avenue, N6",2067195000,3,Detached
117,"The Bryanston, Hyde Park, 55 Bryanston Street, Marylebone, London, W1H 7BZ",2014190000,7,Apartment
118,"The Bryanston, Hyde Park",2014190000,7,Flat
119,"View Road, Highgate, London, N6",2008889500,7,Detached
120,"Hanover Terrace, London, NW1",2008889500,7,House
121,"Hanover Terrace, London, NW1",2008889500,7,Terraced
122,"Hanover Terrace, Regent's Park, NW1",2008889500,7,Terraced
123,"Hanover Terrace, Regent's Park",2008889500,2,House
124,"View Road, Highgate, N6",2008889500,7,Detached
125,"Caversham Road, Beaufort Park, Colindale, NW9",56715350,4,Apartment
126,"Lygon Place, Belgravia, SW1W",1961185000,6,End of Terrace
127,"The OWO, Whitehall, London, SW1A",1961185000,6,Apartment
128,"Bourdon Street, Mayfair, London, W1K",1934682500,6,House
129,"Bourdon Street, Mayfair, W1K",1934682500,7,Town House
130,"Highwood Lodge Farm Estate, Highwood Hill, London, NW7",1908180000,7,Equestrian Facility
131,"Parkside, Wimbledon Village, SW19",1908180000,8,Detached
132,"Highwood Lodge Farm Estate, Highwood Hill, Mill Hill, London, NW7",1908180000,5,Detached
133,"Harley Street, Marylebone Village, London W1",1908180000,7,Terraced
134,"Herbert Crescent, Knightsbridge, London",1908180000,7,House
135,"Parkside, Wimbledon, London, SW19",1908180000,8,Detached
136,"Lanson Building, Chelsea Bridge Wharf, London, SW11",1908180000,6,Apartment
137,"Winnington Road, Hampstead, London, N2",1908179893,6,Detached
138,"Winnington Road, N2",1908179893,4,Detached
139,"Garway Road, Notting Hill, London",1902879500,5,Detached
140,"Chesham Place, London, SW1X",1902879500,6,Apartment
141,"Culross Street, Mayfair, London, W1K",1902879500,5,Terraced
142,"Garway Road, London, W2",1902879500,36,Detached
143,"Lancelot Place, London, SW7",1881677500,5,Town House
144,"Kenway Road, London, SW5",1881677500,3,Block of Apartments
145,"Lancelot Place, London, SW7",1881677500,5,Town House
146,"Lancer Square, Kensington Church St, London W8 4LD",1876377000,5,Penthouse
147,"Vicarage Gate House, London, W8",1855175000,5,Flat
148,"Vicarage Gate, London, W8",1855175000,2,Apartment
149,"Vicarage Gate, Kensington, London, W8",1855175000,7,Flat
150,"Ennismore Gardens, London, SW7",100709500,6,Apartment
151,"Cadogan Square, Knightsbridge, London, SW1X",1855175000,7,Apartment
152,"Eaton Place, London, SW1X",1855175000,3,End of Terrace
153,"Kensington, London, W8",1855175000,3,Apartment
154,"Brompton Square, Knightsbridge, London, SW3",1855175000,4,Terraced
155,"Lancer Square, Apartment 27, 1 Lancer Square, Kensington Church St, W8",1855175000,10,Penthouse
156,"Manhattan Loft Apartments, London, E20",1855175000,6,Penthouse
157,"Knightsbridge, London, SW1X",1828672500,6,Apartment
158,"Hamilton Terrace, London, NW8",1802170000,13,Detached
159,Chester Terrace,1796869500,7,End of Terrace
160,"Chester Terrace, Regent's Park, London, NW1",1796869500,6,Terraced
161,"Eaton Place, London, SW1X",1796869500,10,Apartment
162,"Courtenay Avenue, London N6",1796869500,6,Detached
163,"Melina Place, St John's Wood, London, NW8",1775667500,7,Semi-Detached
164,"Lowndes Street, Belgravia, London, SW1X",1749165000,10,Terraced
165,"Cranley Gardens, London, SW7",1749165000,8,Terraced
166,"Elgin Crescent, London, W11",1749165000,7,Semi-Detached
167,"Lowndes Street, London, SW1X",1749165000,7,Terraced
168,"Charles Street, Mayfair, W1J",1749165000,5,House
169,"Elsworthy Road, London, NW3",1749165000,4,Detached
170,"Belsize Lane, Hampstead, London, NW3",1749165000,4,Detached
171,"Wilton Crescent, Belgravia",1749165000,5,House
172,"Knightsbridge Gate, Apartment 3, 1 William Street, London, SW1X",1722662500,2,Apartment
173,"William Street, London, SW1X",1722662500,5,Apartment
174,"Lancelot Place, London, SW7",1712061500,5,Town House
175,"Woodland Way, Mill Hill",55655250,6,Flat
176,"Lancelot Place, London, SW7",1712061500,6,Town House
177,"Lancelot Place, London, SW7",1712061500,4,Town House
178,"South Audley Street, London, W1K",1696160000,4,Apartment
179,"South Audley Street, Mayfair, London, W1K",1696160000,8,Apartment
180,"Lancer Square, Residence 22, 1 Lancer Square, London, W8",1696160000,3,Apartment
181,"Lancer Square, Kensington Church Street, Kensington W8 4LD",1696160000,3,Apartment
182,"Hyde Park Gate, London, SW7",1696160000,6,Penthouse
183,"Eaton Mews South, London, SW1W",1696160000,4,Town House
184,"Eaton Mews South, Belgravia, SW1W",1696160000,6,Mews
185,"Park Square West, London, NW1",1690859500,4,Terraced
186,"William Street, London, SW1X",1690859500,3,Apartment
187,"Park Square West, Regents Park, London, NW1",1690859500,6,Terraced
188,"William Street, London, SW1X",1669657500,6,Apartment
189,"Arlington Street, St. James's",1643155000,3,Flat
190,"Norfolk Road, St John's Wood, NW8",1643155000,3,Detached
191,"Bedford Gardens, London, W8",1643155000,6,Town House
192,"Walpole Mayfair, Arlington Street, London, SW1A",1643155000,4,Penthouse
193,"Arlington Street, SW1A",1643155000,7,Penthouse
194,"Bedford Gardens, Kensington, London, W8",1643155000,5,Semi-Detached
195,"Lancer Square, Kensington Church St, W8 4LD",1643155000,5,Apartment
196,"Park Street, Mayfair",1590150000,5,Flat
197,"Academy Gardens, Duchess of Bedfords Walk, London, W8",1590150000,2,Apartment
198,"Chester Square, London, SW1W",1590150000,3,House
199,"Cannon Lane East Heath Road, Hampstead, NW3",1590150000,7,Semi-Detached
200,"Clapham Common West Side, Battersea",58305500,6,Flat
201,"Park Modern, Apartment 51, 123 Bayswater Road, London, W2",1590150000,6,Apartment
202,"The Bishops Avenue Knolehurst, London, N2",1590150000,6,Detached
203,"The Bishops Avenue, London, N2",1590150000,6,Detached
204,"Chalcot Square, Primrose Hill, London",1590150000,7,Terraced
205,"Gore Street, South Kensington SW7",1590150000,3,Terraced
206,"GORE STREET, London, SW7",1590150000,7,Terraced
207,"Acacia Road, St Johns Wood, NW8",1584849500,5,Detached
208,"Moxon Street, W1U",1584849500,5,Block of Apartments
209,"Acacia Road, London, NW8",1584849500,6,Detached
210,"Gilston Road, Chelsea, London",1584849500,5,House
211,"Chester Street, London, SW1X",1584849500,5,Terraced
212,"Gilston Road, London, SW10",1584849500,5,Terraced
213,"Pont Street Mews, London, SW1X",1584849500,7,Mews
214,"Pont Street Mews, Knightsbridge, London, SW1X",1584849500,3,House
215,"Ovington Square, London, SW3",1584849500,3,Terraced
216,"Acacia Road, St John's Wood, London, NW8",1584849500,4,Detached
217,"Marylebone Square, Marylebone W1",1584849500,4,Flat
218,"South Audley Street, London, W1K",1563647500,8,Apartment
219,"Lancer Square, Apartment 23, 1 Lancer Square, Kensington Church St, W8",1547746000,8,Apartment
220,"Lancer Square, Kensington Church Street, Kensington, London W8 4LD",1547746000,5,Apartment
221,"Wilton Crescent, London, SW1X",1537145000,8,Town House
222,"Cheyne Gardens, Chelsea, London, SW3",1537145000,2,End of Terrace
223,"Chester Terrace, Regent's Park, NW1",1537145000,4,Terraced
224,"Cheyne Gardens, London, SW3",1537145000,3,Town House
225,"Chimney Court, 23 Brewhouse Lane, London, E1W",103359750,7,Flat
226,"Craven Street, London, WC2N",1537145000,3,Penthouse
227,"Beaufort Gardens, London, SW3",1537145000,3,Apartment
228,"Wilton Crescent, London, SW1X",1537145000,4,End of Terrace
229,"The Bryanston, Hyde Park, 55 Bryanston Street, Marylebone, London, W1H 7BZ",1510642500,4,Apartment
230,"The Bryanston, Hyde Park",1510642500,4,Flat
231,"Lancelot Place, Knightsbridge",1484140000,5,Apartment
232,"Pembridge Crescent, Notting Hill, London, W11",1484140000,5,House
233,"Pembridge Crescent, London, W11 3DU",1484140000,5,Detached
234,Montpelier Square,1484140000,5,House
235,"Inverforth House, London, NW3",1478839500,4,Detached
236,"North End Way, Hampstead, London, NW3",1478839500,5,Terraced
237,"Knightsbridge, London, SW7",1478839500,7,House
238,"10 Park Crescent, London, W1B",1478839500,8,Apartment
239,"North End Way, Hampstead, NW3",1478839500,6,House
240,"South Street, London, W1K",1478839500,6,Terraced
241,"Cheyne Place, Chelsea",1478839500,3,House
242,"Frognal Way, Hampstead Village, London, NW3",1478839500,5,Detached
243,"South Street, Mayfair",1478839500,3,House
244,"Chelsea Barracks, Belgravia,SW1W",1473539000,6,Apartment
245,"Chelsea Harbour, London, SW10",1462938000,6,Apartment
246,"Eaton Square, London, SW1W",1457637500,9,Apartment
247,"Elsworthy Road, Primrose Hill, London, NW3",1431135000,1,Detached
248,"Elsworthy Road, Primrose Hill, London, NW3",1431135000,3,Detached
249,"Chelsea Waterfront, Chelsea, London, SW10",1431135000,8,Flat
250,London Apartment,87458250,5,Apartment
251,"Beaufort Gardens, London, SW3",1431135000,5,Parking
252,"Chester Square, Belgravia, London, SW1W",1431135000,5,Terraced
253,"Down Street Mews, London, W1J",1426364550,3,House
254,"Down Street Mews, London, W1J",1426364550,3,Mews
255,"Down Street Mews, Mayfair, London, W1J",1426364550,4,Semi-Detached
256,"Marylebone Square, Marylebone W1",1420003950,4,Flat
257,"Moxon Street, W1U",1420003950,4,Flat
258,"Down Street Mews, Mayfair, London, W1J",1407282750,3,Semi-Detached
259,"Down Street Mews, London, W1J",1407282750,3,Mews
260,"Down Street Mews, London, W1J",1407282750,4,House
261,"Buckingham Gate, London, SW1E",1378130000,3,Apartment
262,Buckingham Gate London SW1E,1378130000,5,Flat
263,"Connaught Place, Connaught Village, London, W2",1378130000,4,Apartment
264,"Buckingham Gate, St James's, SW1E",1378130000,5,Apartment
265,Chelsea,1378130000,4,Apartment
266,"Eaton Square, London, SW1W",1372829500,4,Apartment
267,"Hampstead Lane, Hampstead, London, NW3",1372829500,4,Detached
268,Henry Moore Court,1372829500,6,House
269,"Manresa Road, London, SW3",1372829500,3,Semi-Detached
270,"Henry Moore Court, Chelsea, SW3",1372829500,6,Town House
271,"Hampstead Lane, NW3",1372829500,1,Detached
272,"Marlborough Place, London, NW8",1372829500,6,Detached
273,"The Portia Fox Penthouse, One Casson Square, Southbank Place, London, SE1",1372829500,3,Penthouse
274,"Marlborough Place, St John's Wood, NW8",1372829500,6,House
275,"Halley House, Westmoreland Road, London, NW9",37103500,4,Apartment
276,"Marlborough Place, St John's Wood, London, NW8",1372829500,4,Detached
277,"One Casson Square, Southbank Place, Belvedere Road, London, SE1",1372829500,4,Apartment
278,"Rosslyn Hill, London",1351627500,4,Detached
279,"Cadogan Place, London, SW1X",1345796950,4,Penthouse
280,"Hill Street, Mayfair, London, W1J",1335726000,4,Flat
281,"Chester Square, London, SW1W",1325125000,1,Terraced
282,"Chester Square, Belgravia SW1W",1325125000,4,Terraced
283,"Chesham Place, Belgravia, London, SW1X",1325125000,5,Flat
284,"St. Johns Wood Road, London, NW8",1325125000,8,Penthouse
285,"Mayfair Park Residences, Stanhope Gate, London, W1K",1325125000,4,Flat
286,"Pavilion Apartments, St. Johns Wood Road, London, NW8",1325125000,5,Penthouse
287,"Wimpole Street, London",1325125000,8,Terraced
288,"The Bishops Avenue, N2",1325125000,4,Detached
289,"Grosvenor Crescent, London, SW1X",1325125000,5,Apartment
290,"Holland Park Villas, 6 Campden Hill, London W8",1303923000,5,Apartment
291,"The Bishops Avenue, London, N2",1298622500,5,Detached
292,"Lancer Square, Kensington Church St, W8 4LD",1279243872,5,Not Specified
293,"St Anselms Place, Mayfair, London, W1K",1272120000,12,Mews
294,"Wycombe Square, Kensington, London, W8",1272120000,6,Terraced
295,"The Penthouse, 205 City Road, London EC1V 1AT",1272120000,5,Penthouse
296,"Walton Place, London, SW3",1272120000,2,Terraced
297,"Queen's Gate Place, London, SW7",1272120000,3,House
298,"Ingram Avenue, Hampstead Garden Suburb",1272120000,13,Detached
299,"Half Moon Street, London, W1J",1272120000,13,Terraced
300,"Clapham Quarter, Maud Chadburn Place, London, SW4",92758750,5,Flat
301,"Buckingham Gate, St James's, SW1",1272120000,5,Apartment
302,"Kensington Court, London, W8",1272120000,6,Block of Apartments
303,"Kensington Court, London, W8",1272120000,13,Terraced
304,"Chester Terrace, London, NW1",1272120000,3,House
305,"Chester Terrace, Regent's Park, London, NW1",1272120000,5,Terraced
306,"Ingram Avenue, Hampstead Garden Suburb, London, NW11",1272120000,5,Detached
307,"Kensington Court, London, W8",1272120000,4,Block of Apartments
308,Buckingham Gate Westminster SW1E,1272120000,8,Apartment
309,"Barlby Road, London, W10",1271589950,6,Terraced
310,"Barlby Road, London, W10",1271589950,4,House
311,"Adams Row, London, W1K",1266819500,4,Terraced
312,"Upper Brook Street, Mayfair",1266819500,4,House
313,"HARLEY ROAD, PRIMROSE HILL, NW3",1266819500,4,Detached
314,"Adams Row, Mayfair, London, W1K",1266819500,3,House
315,"Adams Row, London, W1K",1266819500,4,Mews
316,"Adam's Row, London, W1K",1266819500,8,House
317,"Adams Row, W1K",1266819500,4,House
318,"Grosvenor Crescent Mews, Belgravia, London, SW1X",1266819500,5,Terraced
319,"Adams Row, Mayfair",1266819500,4,House
320,"Upper Brook Street, London, W1K",1266819500,4,Terraced
321,"Adams Row, Mayfair, W1K",1266819500,3,House
322,"Adams Row, Mayfair, London, W1K",1266819500,9,Terraced
323,"Adams Row, Mayfair",1266819500,7,House
324,"Grosvenor Crescent Mews, Belgravia, SW1X",1266819500,4,Mews
325,"Refinery House, Tandy Place, London, E20",103359750,3,Apartment
326,"Winnington Road, London, N2",1266819500,3,Detached
327,"Harley Road, Primrose Hill, London, NW3",1266819500,7,Detached
328,Adams Row,1266819500,5,Terraced
329,"Montrose Place, Belgravia, London",1250387950,3,Flat
330,"Park Modern, Apartment 42, 123 Bayswater Road, London, W2",1245617500,8,Apartment
331,"Buxmead, 67 The Bishops Avenue, London, N2",1240317000,6,Apartment
332,"Penthouse, Southbank Tower, 55 Upper Ground, SE1",1228655900,2,Apartment
333,"Buckingham Gate, St James, London, SW1E",1219115000,7,Apartment
334,"Abercorn Place, London, NW8",1219115000,5,Detached
335,"Granville Park, London, SE13",1219115000,5,Detached
336,"Clarges Street, Mayfair, London, W1J",1219115000,6,Flat
337,"Granville Park, London",1219115000,5,Detached
338,"Pembroke Walk, London, W8",1219115000,5,Detached
339,"Thurloe Square, South Kensington, SW7",1219115000,5,Terraced
340,"Palace Gardens Terrace, Kensington, London, W8",1219115000,10,Terraced
341,"Walton Place, London, SW3",1219115000,5,End of Terrace
342,"Pembroke Walk, Kensington, London",1219115000,3,End of Terrace
343,"Thurloe Square, London, SW7",1219115000,7,Terraced
344,"Great College Street, London, SW1P",1219115000,6,Terraced
345,"Earls Terrace, London, W8",1192612500,5,Terraced
346,"Park Modern, Apartment 32, 123 Bayswater Road, London, W2",1192612500,2,Apartment
347,"Farm Street, Mayfair, W1J",1182011500,10,Terraced
348,"Craven Street, London, WC2N",1166110000,5,Town House
349,"REDINGTON ROAD, HAMPSTEAD, LONDON, NW3",1166110000,5,Detached
350,"Narrow Street, London, E14",174916500,4,Apartment
351,"Hyde Park Gardens, Hyde Park, W2",1166110000,3,Terraced
352,"Montrose Place, Belgravia, London, SW1X",1166110000,4,Flat
353,"Montrose Place, London, SW1X",1166110000,4,Apartment
354,"Bolsover Street, Fitzrovia, London, W1W",1166110000,6,Penthouse
355,"Montrose Place, Belgravia, London, SW1X",1166110000,4,Flat
356,"Hereford House, Mayfair, London, W1K",1166110000,3,Apartment
357,"Ennismore Gardens, London, SW7",1166110000,4,Flat
358,"Frognal, Hampstead, London, NW3",1160809500,4,Detached
359,"Farm Street, Mayfair, W1J",1160809500,4,Terraced
360,"Park Crescent, London, W1B",1160809500,5,Flat
361,"Knightsbridge, London, SW7",1160809500,4,Apartment
362,"St Marks Crescent, Primrose Hill, London, NW1",1160809500,6,End of Terrace
363,"St. Katharines Precinct, Regent's Park, London, NW1",1160809500,5,Terraced
364,"Beverly House, Park Road, St Johns Wood, NW8",1160809500,7,Apartment
365,"St Katharine's Precinct, London, NW1",1160809500,5,Terraced
366,"Hyde Park Gate, London, SW7",1160809500,3,Semi-Detached
367,"Wilton Place, London, SW1X",1160809500,3,Terraced
368,"Thurloe Square, Knightsbridge, SW7",1160809500,6,Terraced
369,"Beverly House, Park Road, London, NW8",1160809500,4,Penthouse
370,"55 Knightsbridge Gate, Knightsbridge, London, SW1X 7BF",1160809500,4,Apartment
371,"Knightsbridge, London, SW1X",1160809500,2,Apartment
372,"Herbert Crescent, Knightsbridge, SW1X",1160809500,5,Terraced
373,"Addison Avenue, London, W11",1160809500,7,House
374,"Bruton Place, Mayfair, London, W1J",1160809500,5,Terraced
375,"Gibson Street, Greenwich",66256250,3,Maisonette
376,"Farm Street, Mayfair",1160809500,8,House
377,"Thurloe Square, South Kensington, London, SW7",1160809500,4,Terraced
378,"Beverly House, 133 Park Road, St. John's Wood, London, NW8",1160809500,6,Penthouse
379,"Fitzhardinge Street, London, W1H",1160809500,6,Flat
380,"Langford Place, London, NW8",1160809500,4,Link Detached House
381,"Lyall Street, London, SW1X",1160809500,3,End of Terrace
382,"Montpelier Square, London, SW7",1160809500,4,Terraced
383,"Greville Place, St John's Wood, London, NW6",1160809500,3,Detached
384,"The Knightsbridge, Knightsbridge, SW7",1160809500,5,Apartment
385,"Knightsbridge Gate, Apartment 2, 55 Knightsbridge, London, SW1X",1160809500,5,Apartment
386,"Bruton Place, Mayfair, London, W1J",1160809500,7,Terraced
387,"Knightsbridge, London, SW1X",1139607500,4,Apartment
388,"Knightsbridge Gate, Apartment 3, 55 Knightsbridge, London, SW1X",1139607500,8,Apartment
389,"Randolph Road, London, W9",1123706000,3,Semi-Detached
390,"Hans Place, Knightsbridge SW1X",1113105000,3,Detached
391,"Egerton Terrace, London, SW3",1113105000,4,Terraced
392,"Hyde Park Street, Hyde Park, London, W2.",1113105000,6,Terraced
393,"Whistler Square, London, SW1W",1113105000,3,Apartment
394,"The Bishops Avenue, N2",1113105000,4,Land for sale
395,"Park Modern, Bayswater Road, Hyde Park, London W2 3JH.",1113105000,2,Apartment
396,"One Kensington Gardens, 18 De Vere Gardens, Kensington, London, W8 5AE",1113105000,5,Apartment
397,"South Street, Mayfair",1113105000,18,House
398,"Park Modern, Apartment 22, 123 Bayswater Road, London, W2",1113105000,3,Apartment
399,"1 Ebury Square, Belgravia, London SW1W",1107804500,3,Flat
400,"8-9 Upper Dock Walk, London, E16 2GU",54595150,3,Apartment
401,"Palace Gardens Terrace, Kensington, London",1107804500,3,Terraced
402,"Beaufort Gardens, London, SW3",1086602500,6,Terraced
403,"Bayswater Road, London, W2",1086602500,5,Apartment
404,"Montrose Place, London, SW1X",1086602500,5,Apartment
405,The Black Lion,1086602500,4,Not Specified
406,"Montrose Place, Belgravia, SW1X",1086602500,5,Flat
407,"Argyll Road, Kensington, London, W8",1060100000,4,Terraced
408,"Bondway, Nine Elms, SW8",1060100000,5,Penthouse
409,"New Globe Walk, London, SE1",1060100000,6,Flat
